,ID,Title,Meta,Text,URL
19,19,日本第一代丁克，正在疯狂相亲,"Original 淑珍而已 INSIGHT视界
2023-08-12 09:30 Posted on 北京","日本的结婚率，竟然有救了？！
众所周知，日本受不婚主义之苦久矣，虽是世界最发达的国家之一，但结婚率却“奄奄一息”。
据2022年日本政府统计数据显示：男性每4人中有1人（25.7%）、女性每6人中有1人（16.4%）将终生单身；并且，这个数字仍有很大的上升空间。
在日媒针对年轻人是否想结婚的街头调查中，大多数采访者都说不想，并直言：
“一个人感觉太舒服了，根本不想结婚。”
 而当被问到“结婚有什么好处”时，不少人或思考良久，或直言“没有”。
可以说，在日本，不恋爱、不同居、不结婚，早已成为一种主流。
但最近，却有这么一群日本人，开始力挽狂澜，几乎以一己之力拯救整个国家的结婚率？！
这究竟是怎么回事儿呢？

“我已经受够了一个人生活，想要找个伴儿结婚。”
在接受日本经济新闻社采访时，63岁的日本千叶住民志津彻对着记者大方说到。
当节目组在东京都内的一家婚介所遇见志津彻先生时，他已参加相亲活动4个多月、和10多位女性见过面了；至于入会费、月会费、制作简历和拍照等方面的花费，也达到了30万日元（约15000人民币）。
（相亲聚会的情景）
此前，志津彻先生堪称典型的“日本第一代独身主义者”——
年轻时候，对于婚姻、家庭几乎毫无兴趣；
沉迷工作的同时，也尽情享受着单身生活。
但当年岁渐长，他逐渐感受到独自生活的寂寞，对能够相互倚靠的婚姻生活产生了无限向往。
尽管现在行动不便、视力下降，但志津每天都会在会员网站上搜索、点击感兴趣的女性，同时不肯放过任何一个婚恋顾问的推荐，要是感觉还不错，就约对方线下见见面。
（在婚介所进行咨询的志津彻）
”只要找到合适的人，一切就都值了。”
忙碌又坚定的志津，堪称不少日本独身老人的“嘴替”。
截止2023年，在这个全球老龄化最严重国家中，空巢老人数量已700多万，相当于每5个65岁以上的老人就有1人是独自居住。
不少人是因离婚或丧偶，而像志津先生一般至今未婚的情况也比比皆是。
现如今，这些已经走完常规意义上人生3/4进程的老人，对结婚却生出了渴望，并以此，催生出了越来越多的中老年相亲网站、线下介绍所、甚至在线交友APP。
（日本一相亲网站截图，50岁以上老人占53%）
日本健康管理运营的一家中老年大型婚介所表示，目前男性会员的平均年龄为59岁，女性为57岁；
这几年，银发老年相亲十分火爆，光是今年1月，有意入会者的咨询比较3年前就增加了20％。
许多爷爷为了制造共同话题，主动买钢琴、学乐谱；
奶奶也开始涂口红，喷香水，重新穿上碎花衣。
日本部分地方政府自然也嗅到了这个拉升结婚率的好机会，于是官方下场、为民众寻老伴——
日本的滋贺县政府，就与企业及NPO组成了“培养爱情项目应援团”，为当地孤寡老人提供相亲机会；
福井县政府不仅有类似的“福井结婚应援协议会”项目，2021年甚至还引进AI人工智能技术，以提升匹配精确度：
在相亲派对上，老人们戴上特制腕带，简单握握手，对方的爱好、家乡、是否抽烟喝酒、有无婚史等资料，就会马上呈现在自己的平板电脑上。
据日媒报道，项目启动之后，这2县的报名热线异常火爆，热况堪比国内电视购物节目里998元金表金项链的抢购专线。
然而，却很少有人意识到，如此堪称其乐融融、一团和气的景象之下，其实暗藏着日本高龄老人的血泪真相。
在求偶的老年群体中，虽不乏能够提供收入证明、缴纳高昂会员费的中产老人，但数量更为庞大、需求也更为紧迫的，还是那些“下流老人”。
这一群体的数量，足足高达800万人；
而他/她们的诉求，也绝非生活乐趣和精神寄托这么简单。

死了2个多月，她才被发现。
由于在家中摔倒后无力动弹，微弱的求救声穿不透铁门墙壁，在尸骨发臭之前，谁都不知道一位高龄女性在挣扎中痛苦死去。
更不幸的是，此时盛夏已至，遗体高度腐烂后，早已不成人形。
腐坏的血液、体液从她的身体中流出。
蟑螂、苍蝇和蛆虫，逐渐成为房间的新主人。
（图源：纪录片《无人知晓》）
更令人震撼的是，这种极度惨烈兼具视觉冲击性的恶性事件，在眼下的日本社会，却并不稀奇。
每年大约有32000名老人，如此一人，一间房子，孤独断气，无人知晓。
这种情况，被称为“孤独死” ；
这群高龄长者，往往无工作、无收入、无人照顾，被统称为“下流老人”。
可以说，在日本，没有谁比“下流老人”更想结婚了。
因为，如果没有生活上的伴侣，等待这些他/她们的，不只是极不光彩体面的“孤独死”，更是余生宛若凌迟般漫长的凄凉孤寂。 
这些800万老人，绝大多数处于经济与人际关系的双重贫困之中——
据日本政府统计，“下流老人”的年收入普遍在100万-120万日元(约合6万-7万人民币)以下、每月在8万-10万日元(约合5千-6千人民币)以下。
在高消费的日本，这点儿收入无疑寸步难行。
他们之中的很多人，年轻时工作繁忙，无暇结婚、生子，不料却因经济衰退被企业辞退；
有人遭遇老年丧偶，丧失家庭一半的养老金收入，即刻陷入“老后破产”；
还有不少老人常年漂泊在外，早已丢失兄弟姐妹的联系方式，离异后也罕与子女往来。
孤身一人，什么事也没法做，在房间里整天听着老牌收音机，不和人说话、产生交集，是他们生活的常态。
年轻且熟练使用社交网络的我们，可能很难想象与人、与社会失去链接是怎样一种境况。
在日本NHK的一档节目中，一位每天只吃水泡饭的老人这样表示：
“我吃不饱、看不起病，但比这些更痛苦的，是我没有任何朋友、熟人了”。
（83岁的木下良和双腿已经变得虚弱无力，出门时需借助一把椅子才能行走。他每周大概出门一次。他说 ：“即使他们将我的名字刻在墓碑上，也没有人会拜访我的坟墓。” /Ko Sasaki）
据日本劳动力调查结果显示，2022年，超65岁退休年龄的日本老人中，每4名退休老人中，就有1名仍在工作；
并且大多从事3D（脏(Dirty)、累(Difficult)、险(Dangerous)）的非正式类岗位，其身心安全根本难以保障。
除了增加收入，这些高龄劳动者的主要目的，还是其他老人坐在一起，便于社交。
（图源：《老人漂流社会“老后破产”的现实》）
更荒唐又悲哀的是，为了从终日弥漫的孤独中解脱，许多老人甚至不惜犯罪。
2020年，日本法务省发布的白皮书显示：日本65岁以上老人的犯罪率，已占22%；至于重复犯罪率，更是高达70%。
这意味着，很多又老又穷又孤独的“下流老人”，是多次小偷小摸，反复入狱、出狱、入狱、出狱.......
日本监狱，被硬生生变成大型老人活动中心。
 一位85岁的康复庇护所理事长无不悲哀地说：
“人生在世，如果有需要为之努力的人、有可以依靠的人，很少有人会愿意抛弃这一切，走上犯罪的道路。”
老年孤独的恐怖，在于一点点被逼入绝境之感——
身体机能的退化、故人一个个去世、社会话语权的丧失，死神无时无刻近在咫尺。
而这些“下流老人”，比寻常老人更加需要安全感、归属感、认同感，他们的痛苦和绝望，很难透过文字表达。
正因如此，很多可怜的高龄老者才将活着的希望寄托于求偶、相亲之上，渴望能遇见合适的人相互倚靠、走完余生。
但事实，往往更加残酷——
对于这些没有钱，没有工作能力、生活在日本基本保障水平线以下的老人来说，就算成功结婚，终究也只是治标不治本。
一旦伴侣发生意外，等待他们的，必将是更为摧枯拉朽的打击。
（日本大阪，人们在教堂排队领取救济食物）
那么问题来了。
发现老人相亲可以拉动结婚率后，日本部分地方政府绞尽脑汁，思考如何为中老年群体抱团取暖、搭把手过日子提供帮助，堪称反应神速。
难道，就不能管管这800万“下流老人”吗？

实际上，“下流老人”在日本官方话语中，总带有强烈的贱格下流的意味。
2021年，日本网红经济学专家成田悠辅，曾在新闻节目中公开支招：”最终还要靠老年人集体自杀、一起切腹。”甚至还称，未来可能对老人强制安乐死。
连日本副首相麻生太郎也曾发表言论：“老年人病治不好，就赶紧'去死'。”
（成田悠辅）
在经济低迷、就业岗位少、超高龄化的日本社会，这种由官方发布的极端“仇老”言论，自然激化了青年与老人之间的矛盾，以至于日本年轻一代发起了对“下流老人""声势浩大的讨伐。
2022年“敬老日”前夕，日本《现代日刊》网站就报道过，许多年轻网民开始集中谩骂老人，将其称为“老害虫”，不少人表示“想直接把老人杀了”。
而必须必须要说明是，所谓“下流老人”，绝非一群好吃懒做的社会蛀虫。
他们年轻时候和我们大多数人一样，都是兢兢业业勤勤恳恳的普通人。
甚至其中很多人，因为全身心投入工作，根本无法顾及恋爱、结婚、生子。
但在公司破产、企业裁员、雇主跑路的时代洪流之下，他们悄无声息地掉队了。
这群茕茕孑立、艰难过活的人，老后却无不悲哀地发现，无论再怎么打工，都无法积累足够的财富；甚至，无法依靠自己的力量安稳度过余生、有尊严地离世。
于是，他们将目光投向了相亲、结婚，3D工作，监狱，甚至自杀......
而与此同时，日本年轻一代却诞生出穷忙族、茧居族、啃老族，无论疲于奔命还是安然躺平，年轻人都表示“不想结婚”。
或许，年轻人不结婚、老年人相亲热，本就是一体两面。
他们都是日本经济持续低迷、社会老龄少子化之下的“遇难者”。
青年，就是明日的老年；
老年，就是昨日的青年。
时至今日，日本经济发展停滞、政府漠视老年人等弱势群体的深重症结，已经迫在眉睫。
而作为超前发展的人类社会样本，日本所面临的难题，何尝又不是几年后，几十年后，其他国家所面临的难题呢。
本文系原创发布，作者：淑珍而已。欢迎分享到朋友圈，未经许可不得转载，INSIGHT视界 诚意推荐。",https://mp.weixin.qq.com/s/iamlhLhtu8W51lR_pLmUzA
20,20,我真心建议大家买瓶贵点的眼霜，堪称神器！,"INSIGHT视界
2023-08-12 09:30 Posted on 北京","不知道大家有没有感觉到，30岁之后明显不如二十几岁有精力。前一天晚上睡得稍微晚一些，第二天眼周暗沉就特别明显。

其实年龄过了30岁之后，我跟大家一样。

某天对着镜子，发现眼睛周围有了小皱纹，眼角可能也松弛塌......

内心会产生不安和恐惧。恐惧：衰老！尤其是眼睛周围的衰老！

▲左边有眼纹和右边没眼纹的对比

但是我们也发现了，有人40岁，看着却像20多岁，吸引力十足；也有人30岁不到，就出现了眼纹、松弛。

然后，想方设法砸钱去消除眼纹和松弛。只是，当我们花费不菲去尝试各方法前，去弄清楚了：

眼周的衰老......包括......
眼纹和松弛的真正原因是什么？

其实，早在很多年前，英国纪录片《如何延缓衰老》就已经揭示了衰老的主要原因：自由基氧化。

简单来说，我们日常一呼一吸，就会在体内产生自由基。

它会攻击瓦解我们健康的胶原蛋白、皮肤细胞，日复一日，我们的眼角就出现了皱纹、松弛......

所以说，眼部抗老¹，重中之重就是修护自由基造成的氧化受损。

事实上，市面上已经有很多修护抗氧的眼部产品，但有的采用了温和配方，见效缓慢，有的狂堆猛药，又太刺激、伤皮肤。

幸运的是，科学家发现了一种可用于护肤的珍贵食材，在抗氧、保湿方面是个优秀代表，效果好又温和。

用它做成的眼霜，在你眼周轻轻一抹，就能让时间为你踩下急刹车。

而且有意思的是，这个食材，你肯定既熟悉，又陌生，它就是：

黑钻松露：顶級盛宴的美味佳肴
抗老的钻石能量！

说起黑松露，你第一印象可能是米其林餐厅里，超模和贵妇都爱吃的食物。没错，就是它。


而它被用来护肤，是因为它仿佛拥有神奇的生命力：即使被切下一小块，也能再生复原成原来的样子。

这令科学家非常好奇，研究后发现，黑松露含有丰富的蛋白质、多糖物质和特殊功效的氨基酸，具有非常好的抗氧化和修护能力。

李晓凤,杨兵,张华琦.云南野生黑松露营养价值评定[J].食品研究与开发,2018,39(11):157-161.

经过几年研究，科学家们成功将黑松露精粹提取到了眼霜中，这成为护肤界一件激动人心的事件。

因为，人们终于找到了一种更有效、更安全的抗老成分，它能修补氧化受损的细胞，改善眼纹和松弛下垂。

“打个不恰当的比喻，如果你30岁时开始大量用黑松露眼霜，同龄人已经长了眼纹看着像40岁了，而你却看起来好像还停留在31岁。”


要知道，黑松露对生长环境很挑剔，阳光、水分、土壤酸碱度稍微有变化就无法生长，全球只有在法国、意大利等少数地方的森林深处才能找到质量上乘的黑松露。

而且它们目前还不能大规模人工栽培，年产量稀少，素有“黑钻石”之称，在价格方面自然是水涨船高。

因此，它一出现，就立刻被大牌盯上了，像你知道的*诗*黛就专门用它做了一条高端的抗老产品线，明星、贵妇都抢疯了。

▲图片来源：*诗*黛官网，截取自2022.06.10

从功效上来说，黑钻松露可以说是很优秀的成分了！只是，它也有一个不易解决的缺点：不好吸收。

跟所有昂贵的植萃（人参、灵芝）一样，单纯提取的黑钻松露精粹吸收有限，可能你涂上眼，30%被吸收了，另外70%都被浪费了。

这个难题几乎困扰了市面上所有的厂家和品牌，少有几个解决了这个问题的，基本都是舍得砸钱研发的大牌。

这时，你可能会问：“除了大牌，有没有其他品牌解决了这个难题的？”

当然有！这也是我今天要给你推荐的，一款贵妇级抗老的黑钻松露眼霜。

它是我们的老朋友植卡美，新推出的黑钻松露眼霜，核心成分是意大利进口黑钻松露，添加量非常丰富。（这是她家高端线的抗老产品）


植卡美研发团队，为了提高黑钻松露的吸收率，历时三年，才从几百种配方中找到了黑钻松露的完美搭档：黑酵母。

你可以这样理解它们的关系，黑酵母就像碎石机，把黑钻松露这个“大石头”里面的营养成分，打散打细成容易钻进皮肤的小分子成分。

这种黑吃黑的配方，很好提高了皮肤对于黑钻松露精萃的利用。

▲分解后的黑钻松露，分子变小

你可能会质疑，真这么有效吗？别急，植卡美和原料商做了大量实验，你看看就知道它的效果有多强悍。

为了验证黑钻松露即时紧致、抗皱的效果，他们请了志愿者，涂抹后，你可以看到眼角和额头的皱纹明显淡了很多！

< 图片来源：瑞士Activen原料供应商>

这个用来救急非常好用。如果你周末要和朋友约吃饭，化妆的时候，可以先涂上一层这个眼霜，能防止卡粉脱妆，还可以将某些小细纹“紧急隐身”。

然后当你到了后，她们会围着问你：“你昨天是不是去做医美了，前几天看你眼角明明有细纹，怎么现在好像都不见了......”

小红书@焦个朋友

用眼霜，你肯定看重的是长远效果，因此，他们还做了测试，皱纹长度和深度明显的改变！

所以你要有心理准备。一段时间后，当你带娃下楼去游乐场玩的时候，碰上儿子同学他妈，她会惊讶你怎么变化这么大，然后一个劲拉着你，羡慕地问你怎么办到的......

< 图片来源：瑞士Activen原料供应商>

抗皱像买保险，一份不够稳当，两份勉强放下心头大石，三份才能安心睡个好觉。

于是，这款眼霜还壕气地添加了两种抗老界翘楚：芋螺毒素肽和乙酰化玻尿酸。

三重保险下，如果你坚持涂这款眼霜，你就会惊喜地发现，你的状态不输那些经常做医美的朋友！

连国家认证的专业检测机构，都给出了证书：抗皱、紧致、舒缓功效显著。


所以，如果你发现眼角出现了皱纹，松弛，你又不想做医美，只想用简单有效的方式来保养自己，那么，植卡美黑钻松露眼霜会是你不错的选择。

而且你放心，还帮你在美丽修行上查了，它是不含香精、无防腐剂、无风险成分的，皮肤敏感的朋友可以放心用！


你不必犹豫，因为，在眼睛上花点小钱，真的可以让你快人一步，远超你的闺蜜，同学，同事，身边的同龄人......

把她们从现在开始就远远抛在身后，要不了多久，她们就会惊讶的发现：“你怎么越来越年轻了？”

上眼不油不黏
一触即融，好吸收不长脂肪粒

拿到手的那一刻，你可能会和很多人一样，第一感觉就像是几千块的贵妇品牌出的新品，精致奢华，质感拉满。


捏开瓶盖，淡黄色慕斯状的眼霜映入眼帘，用手一呲溜就抹开了，“是一滑到底的那种，抹开就渗进去了，不油腻也不闷。”

闻起来，有股淡淡的黑松露清香，吸收时凉凉的，就好像你走在刚下过雨的森林里，风裹挟着水汽拂过你的眼角。

小红书@爱吃年糕呀

还有一个很让我们惊喜的是，这款眼霜很贴心地配置了一个鎏金微导棒。

你可以在晚上洗漱后，用它蘸取黄豆大小的眼霜，轻盈地在眼周打圈，对着镜子看眼角慢慢变得水润、饱满......


当然，你还可以厚厚地涂一层眼霜，放一首喜欢的音乐，边放空边用它按摩，让自己放松下来，去享受这片刻的美好。

然后，早上起来，你可能会惊喜地发现眼角紧致水润，摸起来弹QQ的。

小红书@茸茸猪

我们认为，眼部保养是个长期的工作。

也许你可能不需要繁琐的护肤步骤、不需要用面部仪器、不需要进美*院，只需要将你现在用的眼霜换成黑钻松露眼霜即可。

产品真实使用反馈
 用过的直呼：效果太惊艳

你可能不知道，这款眼霜上市时，首批产品基本上全部被植卡美VIP老粉内购完了。

她们一用就爱上了这个贵妇眼霜，很满意它的效果、肤感，你可以看看植卡美提供的反馈图就知道：


此外，植卡美商务还分享了他们几个老粉的购买故事：

有个老粉内购的时候，推荐了自己的姐妹过来，她看了介绍后，一口气买了5瓶。后面回访的时候，她说：

“上周末，儿子带同学来玩，进门就管我叫姐姐，瞬间开心地不得了。”

小红书@87年的陈爱喜

还有个中学老师，也买了这个眼霜：

“每天勤勤恳恳地用，寒假的时候在街上碰到学生，他们盯着我好一会儿，才敢跟我说话，说我大变样了，还问我是不是去做什么医美了......”


30+女人的第一瓶黑钻松露眼霜
现在买，享超大力度优惠

最后，想再给你们介绍下植卡美Facial Joy这个品牌。

我们跟植卡美其实结缘已久，刚开始推荐的时候，它还比较小众，知名度还没那么高，现在已经是护肤界的“大咖”了，我身边基本上每个人都有在用。

因为产品实在做的太棒了，植卡美已经先后被评为：“京东美妆飞跃品牌”，“中国护肤品新锐品牌30强”，“天猫宝藏工厂品牌”，“腾讯超新星品牌”。
▲用心做产品的品牌一定会被认可

能够同时被京东、腾讯、天猫官方选中的品牌，其实力和口碑可想而知！

这款黑钻松露眼霜，是植卡美新推出的旗舰抗老产品，里面汇聚了瑞士、意大利、韩国的科技和成分，代表了国际护肤高水平的研发成果。

它有着几乎可以媲美肉毒素注射的替代方案，再加上珍稀黑松露带来的奢华营养，让你在家就能享受到接近院线级的护肤体验。


做过医美的朋友都知道，到正规医院，注射肉毒素大概一针在3k到5k左右，想稳定，还需要多次注射。

而添加有黑钻松露、芋螺毒素肽这些成分的大牌产品，大多都是1000起步，更有甚者直接卖到了4000+。

按理，这款眼霜，应该像这些稀缺的高端产品一样，定价至少也要上千。但植卡美为了回馈老客户，让大家可以无负担享受到贵妇级体验，前几批眼霜的售价，基本上是贴着成本价卖的。

而且，由于原材料的稀缺，这款黑松露眼霜前几批只有几千瓶，并且品牌VIP老粉已经内购掉了80%。

凭借着跟植卡美合作多年的关系，也只能给咱们粉丝提供200份，每个ID只能限购3份。

所以想自己体验，或者买来当礼物的，立即行动起来！

超值福利价来了

作为植卡美旗舰抗老产品，这瓶眼霜的日常价是458元，按一瓶用3个月算，每个月只要150多，一件衣服的钱，就把眼纹给隐身了。

你算一笔账就知道多划算了：

现在普通保湿的眼霜，一般也要4、500，还未必能淡化眼纹。你要是去美*院保养去皱，随便一个项目都是上千，想稳定还得经常去。而既能保湿、又能抗皱的黑钻眼霜，只要458元，一瓶用完，看起来年轻了好几岁，还省了大几千保养费！

更何况，今天，还特地为你们提供了专属福利价：

今天下单的粉丝，在日常价的基础上，再减110元，一瓶只要348元！这个价格只限这一次。

两瓶只要596元，相当于只要298元/瓶，建议你最少买两瓶，够用大半年，用完你会发现自己的眼角饱满紧致，更显年轻！

三瓶囤货装最划算，仅需870元，相当于只要290元/瓶！这个价格，比双11大促还便宜了318元！相当于省下了一瓶眼霜钱。

不管你是买来自用，还是送亲人或者朋友，今天买都是最优惠！


因为价格不便宜，担心大家有顾虑，所以，我在优惠之外，还特地争取了一份安心险：凡是购买眼霜均会附赠价值119元的体验装。

你在收到货后，可以先拆体验装试用30天，如果不满意的话，可以联系客服全额退货退款。价值119元的体验装，你仍然可以自己保留。

所以，不妨零风险验证试试，给自己一个机会吧。

视界·读者专享
Ⅰ、买即赠1瓶3g小样。
Ⅱ、先使用赠送的小样，正装不拆支持30天内全额退货退款。
点击下图即可购买 👇
✨有任何疑问可添加文末店长微信咨询
默认顺丰包邮，顺丰不到地区发邮政

如果你已经超过30岁了，抗老，最好的时间是五年前，其次是现在。如果你还年轻，那么今天你就掌握了一项，比同龄人更有吸引力的秘诀。

刘嘉玲说过：“我坚持抗老，并不期待第二天衰老问题就没有了，而是当我50岁的时候，看上去仍是30岁。”

优雅的老去，也是一种选择。

视界·读者专享
Ⅰ、买即赠1瓶3g小样。
Ⅱ、先使用赠送的小样，正装不拆支持30天内全额退货退款。
点击下图即可购买 👇
✨有任何疑问可添加文末店长微信咨询
默认顺丰包邮，顺丰不到地区发邮政


查询物流、售前售后服务
以及想了解更多产品
关注：植卡美Facialjoy公众号

本产品效果因人而异，因使用者自身情况、使用时间和方式等，可能会存在实际使用效果的差异。数据引用自文献：[1]指黑孢块菌提取物；[2]抗老指的是由于抗氧化作用显著而发挥抗皱、紧致功效；文案及售后由植卡美提供。

文末福利
分享植卡美产品的使用感受/走心留言
抽2名互动留言
包邮送出旅行套装一份

👇点击“阅读原文”，购买体验“逆生长”的感觉",https://mp.weixin.qq.com/s/5g32KJAzI7UkY5A3xZ7xEQ
