,ID,Title,Meta,Text,URL
0,0,留学生被20万卖到缅甸刷屏后，有人问“国家为啥不能直接轰炸缅北？”,"Original 淑珍而已 INSIGHT视界
2023-08-16 09:30 Posted on 北京","就在昨天，那个在缅北失联的20岁汕头男孩，终于平安回来了！
此前，陈某在7月3日从深圳出发前往北京，但在京滞留20天后，他突然前往云南西双版纳，如此古怪的行为，已经让父母觉察到不对劲；
7月26日，陈某给母亲发了一个表情包，配图是一只被抓住的小猪崽，图片上赫然写着“我怕是要死了”。
留下这条语焉不详的讯息后，陈某随即失联了整整15天......
期间，已经确认儿子深陷险境的陈某父母不断四处奔走，在网络发布寻人启事、并求助警方寻人。
当警方查证陈某手机的最后定位在缅甸果敢时，几乎所有人都倒吸了一口凉气。
万幸的是，在警方的多方努力之下，就在昨天，陈某终于被警方解救出来，平平安安地回到了父母身边，现如今，他正在边境地区的派出所接受调查。
这则喜讯也迅速冲上微博热搜，陈某的遭遇，无疑牵动着数百万网友们的心。
原因无他——
真实的缅北，是一个罪恶蔓延、残酷血腥的人间炼狱。
普通人踏上这片土地，最大的可能性是被吃干抹净，连渣子都不留。
在决定做这期选题之前，主页君觉得，自己已经做足了充分的心理准备。
但在查询缅甸kk诈骗园区的相关资料时，还是被Google地图的地点标注吓了一跳——
kk园区水牢、缅甸腰子中转、腰子拍卖大厦，还有“鸡店”、“鸭店”、“堕tai所”，甚至填埋场、万人坑等等等......
一个个地标极其耸人听闻，且十分详尽，光是看着就让人心惊胆战。
（Google地图截图）
是的，虽然Google地图能够个性化编辑、被网友标注，但这些不法手段并非空穴来风，都 是 真 的。
这几年，不少从缅甸逃脱的幸存者披露了自己的遭遇，也让我们得以窥见罪恶的冰山一角。
地图中的这个处于缅甸妙瓦底的kk园区，被幸存者们称为“猪仔炼狱”，其犯罪分子手段极其凶残；而妙瓦底这一处基地本身还不属于更加臭名昭著的缅北地区，但已经有14个可查证的大型诈骗园区，并且还在持续拓建之中！
毫无疑问，缅甸的诈骗园区正在扩散，罪恶仍在不断蔓延；
而犯罪分子的手段也越来越隐秘，欺骗性越来越强，让人防不胜防......
（kk园区周边景象 | 图源：浙江新闻）
作为英国利物浦大学的留学生，95后的男孩张浩（化名），前程可谓一片光明。
去年6月份，张浩成功应聘上了泰国一家跨境电商公司的翻译岗位。
这家号称由中国人开办的公司，一切看上去都十分正规；在谨慎查证背景、并经该公司几轮面试后，张浩才终于拿到了这个月薪2万、中英翻译岗位的offer。
然而，当他满怀期待地来到泰国曼谷，等待他的却不是人生的新篇章，而是电信诈骗集团。在前来接机的“同事”的安排下，张浩被几经辗转偷渡来到了缅甸。
等张浩察觉自己已经到达妙瓦底的时候，一切都来不及了。
后来张浩才知道，自己被那家所谓的“跨境电商公司”以20万的价格转卖到了这家电信诈骗公司，自此，在这个不见天日的“犯罪天堂”，张浩开始了长达8个月的噩梦。
必须要说明的是，尽管出身名牌大学，但张浩与其他缅甸幸存者的遭遇相差无几：
第一步，没收你的护照、身份证和手机，园区外每天都有荷枪实弹、或拿着大砍刀的武装巡逻，完全切断和外界的联系，叫天天不应、叫地地不灵。
第二步，告诉你船票、飞机票、组织费一共花了多少多少，逼你写下借条，以威胁你交出赎金或参与诈骗工作。
数值一般高达几十万，里面的费用明细十分荒诞可笑 ——
不仅有常规的伙食费、床位费、水电费，还有键盘、地板、座椅磨损费，甚至呼吸一口空气都要收钱，摆明了就是敲诈。
第三步，就是接受电信诈骗培训，专骗中国人，每天干十几个小时，如果不愿意让别人倾家荡产、或者嘴笨开不出单，那自己就得每日遭受虐打、围殴、电击，直到彻底泯灭良知。
而逃跑被抓，穷凶极恶的诈骗头子杀一个人仿佛捏死一只蚂蚁一样容易。
据一位死里逃生的警察线人称，曾经看到两名男同事从窗户爬下去逃跑，但不幸被发现，便遭遇轮番毒打，打残之后就被卖到别的地方了，“之后再也没有见过他们”。
2023年1月初，张浩只是在网盘上传了几张图片，就被组织怀疑是“企图与外界联络、谋划越狱”，随即被关到小黑屋。
“双手反铐着坐在地上，他们拿电棍不断捅我，蓝紫色的电流劈里啪啦地打在我身上，电击完紧接着又是铁棍暴打，后背被打成了紫黑色”。
足足被折磨了18天之后，张浩才被放出。
而他被虐待的视频，则被发给远在台州的父母，“赎金”起价40万。
但收到赎金后，该诈骗团伙也没有放人，而是贪得无厌地索要更多。
（张浩被电棍电击 | 张浩本人供图）
这段不堪回首的惨痛经历，却被张浩认为已经十分幸运——
“有的人被剥夺睡眠，整个人吊起来几天几夜不许合眼，还有的人在反抗时被剁掉好几根手指。”
“全程都被监控，睡觉的时候都被单手拷在床沿”，在这种数名保安7×24小时轮班监视的情况下，张浩直白地表示，“你连自杀的机会都没有”。
至于有些更加阴毒的诈骗园区人员，甚至会向劳动者提供免费毒品，并强迫吸毒，令其染上毒瘾。
如此一来，由于无法缴付高昂的毒品费用，受害人即使获救，也会因担心无法获取及支付高昂的毒品费用，因而不愿离开园区，从而继续在园区进行诈骗工作。
如果实在无法付出赎金、也没有可利用的价值，你的器官就会被强制收割，放到东南亚黑市明码标价，而尸身则被即刻丟入海中。
而据官方报道，倒是有清清白白回国的案例，但代价，是他的4根手指头永远留在了缅甸......
种种极端暴力，不止带来肉体上的折磨，更是精神上的极大威慑。
可以说，在这种情况下，绝大多数人都会抛弃良知，成为诈骗头子们的奴隶，日复一日地骗人。
然而，完成不了业绩的也会被体罚，最常见的是深蹲、跑步。
听起来还可以？但一次要做2000个。
再后来失去耐心后，会直接上电棍；
还有更加骇人听闻的水牢，水位淹到下颚处，人只能踮着脚呼吸，非常痛苦，屎尿都撒在水里，引来无数蚊虫叮咬......
而讽刺的是，尽管是名牌大学的留学生，张浩也要从最底层的客服做起。
每天14-17个小时间，他被迫在网上寻找“猎物”，伪装出各种人设，与远在中国的受害人们保持友谊、暧昧、网恋，将开始投资骗局的引导。说白了，就是“杀猪盘”。
实际上，从寻找诈骗对象、筛选、沟通、诱导到实施诈骗或敲诈，诈骗团伙都有细致的话术指导意见，甚至还会特邀心理学家撰写，一份最高可以卖到上百万元，把各类人群的人性弱点分析得透透的：
还有的人，甚至连从事诈骗的机会都没有。一些面容姣好的年轻男女会被挑中、被迫从事性服务，不少女性因被强暴而怀孕，开头google地图上的“堕胎室”并非完全是网友杜撰......
万幸的是，在今年1月份，得知张浩真实遭遇的家人果断报警，之后台州市公安局通过多方通力协作、多途径合力施救，最终在缅甸军方的协助之下，将张浩成功解救了出来，并在2023年2月2日安全返回国内。
惊魂未定的张浩说：“能活着回国，实属万幸。”
他告诉记者，据他所知，有的人是从缅北被卖到了妙瓦底，有的人则是被高薪招聘信息骗来，像自己这样从泰国被绑架过去的也不算个例。
(张浩被家人接回到国内 | 张浩本人供图)
种种受害者的经历让人怵目惊心、头皮发麻。
性犯罪、绑架勒索、人口贩卖、人体器官买卖...可以说，这些黑色交易每天都在缅北上演。
几乎所有侥幸回国的人，都有一段惊心动魄的历险记、血泪路，身上也留下无法抹去的伤疤。
在知乎有一个热门问题，有人疑惑“为什么缅甸残害那么多条生命，（咱们）国家还没有出面去管？”有2100多个回答，1200万次浏览。
而扒扒缅甸诈骗相关新闻的评论区，也有不少网友表示“请求直接轰炸缅甸”：
由此可见，国内很多人对“国家不出手”这件事儿感到极度困惑。
说实话，主页君也曾一度想不明白——
如此穷凶极恶、泯灭人性的缅甸犯罪团伙，操弄数以万计的中国劳工、诈骗中国老百姓，为什么咱们不能出面把缅甸一锅端了呢？
但问题的关键就在于，缅甸虽然是一个独立的主权国家，但其国内并不团结。
至于地处中缅边境、紧邻我国云南省的缅北地区，则主要指缅甸境内的克钦邦、果敢等缅甸北部自治区；其之所以会变成今天的人人畏惧的犯罪猖獗之地，更是有极为复杂的历史原因，以及特殊的地缘、司法等特征的多重糅合。
（缅甸与中国的方位图）
1886年，在英国殖民统治挑拨下，缅甸的135个民族共分裂出大大小小上百个武装势力。
在这其中，缅北地区的武装势力更是肆无忌惮，多年来一直处于军阀割据的混乱状态。
直至今日，缅甸政府自己都无力管制、不敢轻易招惹，更遑论中国。
如此一个最直接的影响就是：
现在中国警方同其它东南亚地区或多或少都有打击犯罪、跨境联合执法的协作，但在缅甸地区，则由于各个地方武装分子的包庇和不合作，中国警方暂时无法进行抓捕。
一位在缅甸经商的中国人曾对记者透露，当地某园区的一位高层曾经高调宣布：”妙瓦底这里别说干诈骗，就是开个杀人工厂都没人管“。
就这样，缅甸因长期的贫困、混乱与极端暴力，催生出了欲望的黑洞——
毒品横行、色情赌博、电信诈骗、人口贩卖.....只要能够制造税收，便无所不用其极。
人的贪欲生成一条条错综复杂的黑暗产业链，也让缅甸也成为犯罪重镇，将罪恶的魔爪频频伸向中国人民的钱袋子。
大家一定还记得，在国内，网络电信诈骗案件曾经一度铺天盖地，咱们在座的各位，谁如果至今没接到过诈骗电话，都可以直接出门左转买张彩票了。
光是2020年一年，全国电信网络诈骗财产的损失，就高达353.7亿元。
要知道，京东这么大的公司，同年的净利润“也就”494亿元。
近年来，在大数据和AI的加持下，骗子们的骗术愈发精准和专业，紧跟社会热点、快速更新迭代诈骗模板已经不在话下，甚至技术支撑链条也已经十分完善。
还有这些群控设备，一个架子上就有上百台手机，不断自动操作；
至于猫池、GOIP、短信嗅探等等高精尖的通讯设备也是说安排就安排......
而根据警方公布的数字，电信诈骗的破案率仅为1%。至于追回的金额，甚至连1‰都不到。
这是因为账户多在境外，而一旦得逞，诈骗团伙就会把钱分发到各个账户，并让专门的车手去取钱，上线下线关系错综复杂，目的就是让赃款无法被追踪、让公安机关追回资金困难重重。
2019年，根据@终结诈骗统计，平均每1万人中，就有26.1人被骗。
诈骗，已经跃升至侵害人数最多、增长最快的违法犯罪类型，没有之一。
这些凶恶阴险的诈骗分子，就像是伏在中国大陆身边的一条条恶心的蚂蟥，贪婪的吸食着中国老百姓的血液。
据警方披露，数百万、上千万甚至数千万元的诈骗大案屡有发生，平均被骗金额近5万元。
一夜返贫的案例比比皆是，不知有多少老人的毕生心血被骗子一晚骗走，甚至不少人被逼自杀。
（2019年，一名24岁海口市女孩被骗22万余元后，在家中绝望烧炭自杀 | 图源：南国都市报 ）
而我国警方一直在竭尽所能地进行打击整治诈骗犯罪的行动，在缅泰的多方势力之间斡旋——
从2021年年初开始，在国内已经有十几个地区发布通牒，将以多种手段劝返本地籍缅北电信诈骗人员：
如果参与诈骗、并多次拒绝回国自首，不止本人的户籍会被直接注销，这辈子别想再回来；
其子女也不能在城区学校就读，直系亲属参军入伍和考公务员政审根本别想；
老家也会被喷上“涉诈之家”、“电诈逃犯户”的大字，在社会面上死亡。
而另一方面，国家也贴心开设了“专用回国路线” ，造就了缅北大批诈骗犯回国自首的名场面。
据公安部披露，光是2021年，就从境外教育劝返涉诈人员21万人，抓获从东南亚相关国家回流的诈骗嫌疑人3.6万名，深挖破案1.5万起，打掉非法出境团伙1.2万个，抓获偷渡犯罪嫌疑人5.1万名。
（“这里是缅甸北部，我生长的地方”、“欢迎来到我的世界，娇贵的小公主”）
至于曾一度活跃在国内短视频平台的“缅北文艺团”，也被官方合理地销声匿迹。
如今搜索“缅甸”2字，出现的是各地公安部门拍摄的普法视频，向网友拆穿缅北人间炼狱的真面目。
而如此多方位、多层次的宣传和打击，也使得“缅甸高薪工作、遍地黄金”的诱饵已经不再适用，造成了缅北诈骗劳动力越来越短缺的现实。
于是，狡猾的犯罪集团便在网上刊登”海外征才广告”，仿照正规公司进行精心包装，隐匿背景招聘“高薪技术工”。
因为承诺的高额工资、以假乱真的包装、口罩期间求职不易等原因，一些求职者被犯罪分子戳中了弱点，被诱骗前往去工作也就不足为奇。
所以，95后留学生张浩的遭遇，绝非罕见。
一个新型跨国人口贩卖产业链，正在形成。
（2023年3月，78人揭露“泰国务工”骗局，有高级工程师以20万元被转卖至缅北诈骗营）
骗子们的剧本随机应变，极易洞穿心理防线。
我们每个人，都有可能成为骗子的目标。
世界上几乎所有国家都存在诈骗。
但只有我们有“国家反诈中心APP”，有基层民警一遍一遍给人民群众打防骗的高强度预防针。
公安部门为了反诈所作出的努力、解救被困人员所付出的坚信，你我能够看到的，可能还不足万分之一。
至于我们普通人能做的，除了擦亮双眼、提高警惕，也给他/她们少一些质疑和苛责、多一份体谅和理解吧！
最后的最后，以下是一些联系方式——
缅甸报警电话：0095-199
驻缅甸使馆领事保护电话：0095-943209657
驻曼德勒总领馆领事保护电话：0095-9259172726
外交部全球领事保护与服务应急热线（24小时）：+86-10-12308  +86-10-65612308
希望大家永远、永远用不上。
本文系原创发布，作者：淑珍而已。欢迎分享到朋友圈，未经许可不得转载，INSIGHT视界 诚意推荐。",https://mp.weixin.qq.com/s/oEpNbKWI_IHv76OfqiEudA
1,1,600万接盘北京老破小，新中产后悔了？,"INSIGHT视界
2023-08-16 09:30 Posted on 北京","INSIGHT视界
百万留学生的根据地，这里有最新鲜的海外资讯、最独到的原创观点、最实用的留学干货、最真实的海外故事。专注出国群体，为留学生发声，为留学正名！
1159篇原创内容
公众号
2017年1月，我买下朝阳区北三环的一间老破小。
当时北京的楼市疯涨得特别离谱，一天一个价，我正怀着宝宝，感觉如果再不上车的话，就更买不起了。
匆忙之下，我们很快速地看了几套房。能选择的都是二手房，郊区虽然房子面积大一些，楼稍微新一点，但房价逼近500万，更买不起。亲戚朋友的钱都借遍了，掏空六个钱包，才将就买下这间1986年建成的房子。算上税费，花了近430万。
买下这套房子之前，我和老公每年都要搬一次家，非常疲惫。所以买完这套房子，开心了好久，觉得自己这辈子能买得起一套北京的房子，已经很好了。
后来看趋势才知道，我们算是买在了北京房价的顶点。当时买房的思路也不够成熟，觉得最重要的是选在市区里，离我和丈夫上班的地方都近一些。
这是一个位于北三环的小两居，算上公摊面积不到60平，使用面积可能只有30平。只能放下一张书桌，大人办公，或者小孩子写作业，只能满足一项。
随着年限的增长，老破小的劣势逐渐显现：东西越来越多，家里的空间越来越小；老小区没有什么绿化环境；客厅因为没有窗户常年昏暗；小区物业能力不行；还有，我现在觉得自己爬顶楼也越来越吃力了。
但让我决定卖房的最终因素，还是因为老破小太不保值。
我们的朝阳老破小交通便利，有三条地铁线，附近有三甲医院，但房价就是跑不赢朋友海淀区北五环外的房子，大家买房的时间段和总价都差不多，但经过这几年，人家的房子增值了一两百万，我们的房子却没什么增长。
住在海淀那边的人，遍地985，都是一些年轻、高学历、高智商、高收入的人群，在知名的大企业上班。那边有学区、有高科技产业，圈层也更加纯粹，这些才是支撑房价非常重要的因素。
如果回到2017年让我再选择一次，我肯定不会再选择这套老破小了。不久前，我们以430万的原价卖掉了这套老破小，但这几年的利息、装修、税费，就都算打了水漂了。我们添了一些积蓄，在海淀那边买了一套新一点的二手房，总价一千万左右。
现在的通勤时间当然变久了，不过我可以换工作的嘛。在北京换工作可比换房子要容易多了。
2015年底，为了给家里的小孩更好的教育环境，我们决定买一套老破小学区房。
因为已经有了一套刚需房，这套房子最主要的目的还是奔着好学区而买的，当时的房价虽然没有现在这么离谱，但如果不赶快下手，恐怕就会涨到我们买不起的价格了。所以看了三四套，我们就定下了，总价在305万左右。
这个房子的校区既有小学也有初中，虽然是二梯队小学，已经是我们能力范围内尽力给孩子创造的最好条件了。房子维护得很好，很多人都在抢购，我们跟四五个买家一起争这套学区老破小，买下这套房子的时候既紧张又兴奋。
从2015年到2020年，这套房子的房价一直涨得非常迅猛，单价从6万一路狂飙到16万。租金也从5000多涨到了6000多，每个月收到的房租加上我们的公积金基本可以覆盖房贷，所以经济压力不算大，当时觉得这套房我们真的是买值了。
但2020年之后，由于学区房相关的政策发生了变化，房价有所下降。这两年又因为房地产市场的疲软，房价又持续下跌。今天这套老破小市场上的单价大概不到10万元。
我老公有一点焦虑，纠结没有在单价最高的时候卖掉这套房去打新，买去一个更有潜力的区域。不过因为是给小孩上学用的，不是单纯为了投资，所以我比较看得开。
我和先生都是沪漂一代。结婚前，他已经接手了一套67平、九几年的老破小，在内环和中环之间，我们婚后一直住在这里。
这套自住房老破小，对我们来说只是一个暂时过渡的住所，就是为了留着给以后置换更好的房产用的，所以没有特别用心地去装修。
去年年初我们卖掉了这一套老破小，它的单价从2011年的3万/平米涨到7万/平米。虽然我们卖在高点，单价也算是翻倍了，但在房地产迅猛发展的这十年，这样的价格涨幅，已经落后很多其他区域和类型的房子了。
用置换的钱，我们去周康那边打新了一套130多平的房子，总价也快1000万了。上海房子竞争一直很激烈，我们打新的分数比较低，进不了外环以内，不得不选择一个冷门楼盘。
虽然很多人说学区房会贬值，老破小更会贬值，但对于很多在沪打拼的普通年轻人来说，这不失为一种兼顾生活和经济承受能力的过渡选择。
2021年，我刚刚落户深圳满三年，有了购房资格，就买下这套很小的单间老破小，套内面积也就十平米，连阳台都没有，厨房和卫生间都是共用的，中间有一道推拉门隔着。
当时我作为单身、经济状况稳定的独立女性，特别迫切地想要拥有一套自己的房子。我还去龙岗片区看了一套房，面积很大，价格我也能接受。
但家里人认为买房最重要的是考虑地段，同样是十年前买的房，龙岗片区没怎么涨，但福田的房价已经翻了好几倍。出于一定的投资心理，我还是选择了福田区这套十几平的老破小。
从门口进屋子，到去洗手间绕一圈，只需要三四秒，我就决定要买下这套房。房子的朝向、户型、楼层，我都没有考虑，只想着在福田能买到一个总价低一点、租金回报率高一点的房子，当时在购房app上刷可售房型，真的是一天一个价，所以在匆忙之下就决定了。
本来还想着这套房子三五年后价格可以翻倍卖掉置换一套更好的，没想到，买后一个半月，深圳出台了二手房房价指导价政策，再加上房地产市场这两年一直都不太好，深圳的房价很难再有新的突破。
现在这套房子的指导价，大概在110万左右，租金从2021年的3000/月降到了2600/月，过年期间不太好找租客，还空置了两个月。
经过这段时间房价的涨涨跌跌，我觉得自己好像只是为了背房贷而买房。不过好在租金和我的公积金可以覆盖掉房贷，买房的时候借的25万现在我还得差不多了。
也会庆幸自己还好没有买一套更大的，不然还房贷压力会更大。我有朋友在福田买了一套三居，总价700多万，月供就要5万多，现在看来他的房子单价可能也跌了很多。
在现在房价不明朗的情况下，这套老破小我不会贸然卖掉。这个片区算比较中心的地带，又非常宜居，交通便利，上市公司也多。我会比较期待这里可以有拆迁旧改的一天，我能做的就只有一直等待。
今年我们刚刚选择买下这套老破小，最主要考虑的还是地理位置，通勤比较方便。
同位置的非老破小根本买不起，稍微新一点的00年后的房子都要八九百万起步了。而北京的老破小一直处于一个恒盘的位置，涨不会涨太多，但跌也不会跌太多。
我和另一半准备结婚了，不想再在北京漂泊。像我们这种普通家庭的人，要想在北京上车，第一套房又考虑到市内交通便利的话，选择老破小的人会多一些。
这套房是之前和平里那边的老北京人的拆迁房，大多都是事业单位的员工，整体素质很高，我们拆成毛坯房开始装修，他们也没有投诉，还会帮我们收快递。
刚买下这套老破小的时候，心情很复杂，我和先生都不是北京人，虽然毕业后拿到了北京户口，但一直没有买房子，一直在漂泊，对这座城市也没有什么归属感。
买下这套老破小，它就是属于自己的空间了。作为第一套刚需房，主要考虑它的实用性，我们预计至少会在这里住5年以上。
偶尔也会焦虑房价的涨跌情况。我们看房看了五六个月，是很慎重的决定，但依然不知道这是不是正确的决定。可现在不管它涨还是跌，我也不可能出手了。5 年之后的事谁说得准呢？后不后悔也许只有在未来卖房的时候才知道。
本文系授权发布，From ELLEMEN睿士，微信号：ellemen_china。欢迎分享到朋友圈，未经许可不得转载，INSIGHT视界 诚意推荐",https://mp.weixin.qq.com/s/_eivlGJ9ytQmbw_DHwA8IQ
